{
  "@context": [
    "https://www.w3.org/ns/credentials/v2",
    "https://vc4qi.example/contexts/gs/1"
  ],
  "id": "https://gs-body.vc4qi.example/credentials/FI-1",
  "type": [
    "VerifiableCredential",
    "GsInspectionReport"
  ],
  "issuer": "https://gs-body.vc4qi.example/controller",
  "validFrom": "2026-01-25T00:00:00Z",
  "validUntil": "2029-01-25T00:00:00Z",
  "credentialSchema": {
    "id": "https://vc4qi.example/schemas/gs/1/inspection-report.json",
    "type": "JsonSchema"
  },
  "name": "Initial factory inspection",
  "credentialSubject": {
    "id": "urn:vc4qi-example:site:maker-plant-1",
    "activityTime": "2026-01-20T09:00:00Z",
    "manufacturerIri": "https://maker.vc4qi.example/controller",
    "outcomeIri": "https://vc4qi.example/bindings/gs/1#Pass"
  },
  "termsOfUse": [
    {
      "type": "GsAuthorizationPolicy",
      "authorizationCredential": {
        "id": "https://nab.vc4qi.example/credentials/GS-A",
        "type": "GsAccreditation"
      }
    }
  ],
  "relatedResource": [
    {
      "id": "https://nab.vc4qi.example/credentials/GS-A",
      "digestSRI": "sha384-pucloC8OIjAE+Fa/N11cwYokpwjGWPXCxY9GnldgN9lI1BH/8uu4ZSq/d2vwaEno"
    }
  ],
  "credentialStatus": {
    "id": "https://gs-body.vc4qi.example/status/gs/1#3",
    "type": "BitstringStatusListEntry",
    "statusPurpose": "revocation",
    "statusListIndex": "3",
    "statusListCredential": "https://gs-body.vc4qi.example/status/gs/1"
  },
  "proof": {
    "type": "DataIntegrityProof",
    "cryptosuite": "eddsa-rdfc-2022",
    "proofPurpose": "assertionMethod",
    "verificationMethod": "https://gs-body.vc4qi.example/controller#key-1",
    "created": "2026-01-25T00:00:00Z",
    "proofValue": "z63ujiSsjvyzaUoY7tr9uLyGvKCcznvSWvUGB5tR6uLoC3TvVNDPPCsEFakdr8qsX9Mz99tYtTxfGkCacBLnLieL8"
  }
}
